{
  "boxes": [
    {
      "branchDeg": [],
      "capDeg": 0,
      "crossDeg": -999.0,
      "dangerLevel": 0,
      "distPartialM": 0,
      "distTotalKm": 0.0,
      "index": 0,
      "note": "",
      "pictograms": [],
      "tulip": {
        "entry": [
          0.5000001788139343,
          0.12000000476837158
        ],
        "exit": {
          "at": [
            0.49999985098838806,
            0.8799999952316284
          ],
          "headingDeg": -2.471449988661334e-05
        },
        "points": [
          [
            0.5000001788139343,
            0.12000000476837158
          ],
          [
            0.49999985098838806,
            0.8799999952316284
          ]
        ]
      },
      "turnDir": "none",
      "type": "start"
    },
    {
      "branchDeg": [],
      "capDeg": 0,
      "crossDeg": -999.0,
      "dangerLevel": 0,
      "distPartialM": 300,
      "distTotalKm": 0.3,
      "index": 1,
      "note": "",
      "pictograms": [],
      "tulip": {
        "entry": [
          0.5,
          0.12000000476837158
        ],
        "exit": {
          "at": [
            0.5,
            0.8799999952316284
          ],
          "headingDeg": 0.0
        },
        "points": [
          [
            0.5,
            0.12000000476837158
          ],
          [
            0.5,
            0.8799999952316284
          ]
        ]
      },
      "turnDir": "none",
      "type": "straight"
    },
    {
      "branchDeg": [],
      "capDeg": 0,
      "crossDeg": -999.0,
      "dangerLevel": 0,
      "distPartialM": 124,
      "distTotalKm": 0.424,
      "index": 2,
      "note": "",
      "pictograms": [
        "dip",
        "bumpy"
      ],
      "tulip": {
        "entry": [
          0.4938379228115082,
          0.12000000476837158
        ],
        "exit": {
          "at": [
            0.5061620473861694,
            0.8799999952316284
          ],
          "headingDeg": 0.9290242791175842
        },
        "points": [
          [
            0.4938379228115082,
            0.12000000476837158
          ],
          [
            0.5061620473861694,
            0.8799999952316284
          ]
        ]
      },
      "turnDir": "none",
      "type": "straight"
    },
    {
      "branchDeg": [],
      "capDeg": 40,
      "crossDeg": -999.0,
      "dangerLevel": 0,
      "distPartialM": 176,
      "distTotalKm": 0.6,
      "index": 3,
      "note": "",
      "pictograms": [],
      "tulip": {
        "entry": [
          0.5001424551010132,
          0.12000000476837158
        ],
        "exit": {
          "at": [
            0.49986591935157776,
            0.8799999952316284
          ],
          "headingDeg": -0.020847802981734276
        },
        "points": [
          [
            0.5001424551010132,
            0.12000000476837158
          ],
          [
            0.49986591935157776,
            0.8799999952316284
          ]
        ]
      },
      "turnDir": "none",
      "type": "straight"
    },
    {
      "branchDeg": [],
      "capDeg": 40,
      "crossDeg": -999.0,
      "dangerLevel": 0,
      "distPartialM": 261,
      "distTotalKm": 0.861,
      "index": 4,
      "note": "",
      "pictograms": [
        "dip",
        "bumpy"
      ],
      "tulip": {
        "entry": [
          0.5042887926101685,
          0.12000000476837158
        ],
        "exit": {
          "at": [
            0.495341420173645,
            0.8799999952316284
          ],
          "headingDeg": -0.6745039820671082
        },
        "points": [
          [
            0.5042887926101685,
            0.12000000476837158
          ],
          [
            0.495341420173645,
            0.8799999952316284
          ]
        ]
      },
      "turnDir": "none",
      "type": "straight"
    },
    {
      "branchDeg": [],
      "capDeg": 33,
      "crossDeg": -999.0,
      "dangerLevel": 0,
      "distPartialM": 39,
      "distTotalKm": 0.9,
      "index": 5,
      "note": "",
      "pictograms": [
        "bumpy"
      ],
      "tulip": {
        "entry": [
          0.5609611868858337,
          0.12000000476837158
        ],
        "exit": {
          "at": [
            0.4390375018119812,
            0.8799999952316284
          ],
          "headingDeg": -18.014163970947266
        },
        "points": [
          [
            0.5609611868858337,
            0.12000000476837158
          ],
          [
            0.5470330119132996,
            0.5479033589363098
          ],
          [
            0.4390375018119812,
            0.8799999952316284
          ]
        ]
      },
      "turnDir": "none",
      "type": "straight"
    },
    {
      "branchDeg": [],
      "capDeg": 350,
      "crossDeg": -999.0,
      "dangerLevel": 0,
      "distPartialM": 300,
      "distTotalKm": 1.2,
      "index": 6,
      "note": "",
      "pictograms": [],
      "tulip": {
        "entry": [
          0.500022292137146,
          0.12000000476837158
        ],
        "exit": {
          "at": [
            0.49997836351394653,
            0.8799999952316284
          ],
          "headingDeg": -0.003311743261292577
        },
        "points": [
          [
            0.500022292137146,
            0.12000000476837158
          ],
          [
            0.49997836351394653,
            0.8799999952316284
          ]
        ]
      },
      "turnDir": "none",
      "type": "straight"
    },
    {
      "branchDeg": [],
      "capDeg": 11,
      "crossDeg": -999.0,
      "dangerLevel": 0,
      "distPartialM": 210,
      "distTotalKm": 1.41,
      "index": 7,
      "note": "",
      "pictograms": [],
      "tulip": {
        "entry": [
          0.3491695523262024,
          0.12000000476837158
        ],
        "exit": {
          "at": [
            0.6508453488349915,
            0.8799999952316284
          ],
          "headingDeg": 36.37441635131836
        },
        "points": [
          [
            0.3491695523262024,
            0.12000000476837158
          ],
          [
            0.40722697973251343,
            0.5492549538612366
          ],
          [
            0.6508453488349915,
            0.8799999952316284
          ]
        ]
      },
      "turnDir": "right",
      "type": "turn"
    },
    {
      "branchDeg": [],
      "capDeg": 50,
      "crossDeg": -999.0,
      "dangerLevel": 0,
      "distPartialM": 300,
      "distTotalKm": 1.71,
      "index": 8,
      "note": "",
      "pictograms": [],
      "tulip": {
        "entry": [
          0.49996116757392883,
          0.12000000476837158
        ],
        "exit": {
          "at": [
            0.5000147819519043,
            0.8799999952316284
          ],
          "headingDeg": 0.0040419441647827625
        },
        "points": [
          [
            0.49996116757392883,
            0.12000000476837158
          ],
          [
            0.5000147819519043,
            0.8799999952316284
          ]
        ]
      },
      "turnDir": "none",
      "type": "straight"
    },
    {
      "branchDeg": [],
      "capDeg": 50,
      "crossDeg": -999.0,
      "dangerLevel": 0,
      "distPartialM": 178,
      "distTotalKm": 1.888,
      "index": 9,
      "note": "",
      "pictograms": [
        "dip",
        "bumpy"
      ],
      "tulip": {
        "entry": [
          0.5001587867736816,
          0.12000000476837158
        ],
        "exit": {
          "at": [
            0.49984121322631836,
            0.8799999952316284
          ],
          "headingDeg": -0.023941610008478165
        },
        "points": [
          [
            0.5001587867736816,
            0.12000000476837158
          ],
          [
            0.49984121322631836,
            0.8799999952316284
          ]
        ]
      },
      "turnDir": "none",
      "type": "straight"
    },
    {
      "branchDeg": [],
      "capDeg": 50,
      "crossDeg": -999.0,
      "dangerLevel": 0,
      "distPartialM": 24,
      "distTotalKm": 1.912,
      "index": 10,
      "note": "",
      "pictograms": [],
      "tulip": {
        "entry": [
          0.5001207590103149,
          0.12000000476837158
        ],
        "exit": {
          "at": [
            0.4998880624771118,
            0.8799999952316284
          ],
          "headingDeg": -0.017542799934744835
        },
        "points": [
          [
            0.5001207590103149,
            0.12000000476837158
          ],
          [
            0.4998880624771118,
            0.8799999952316284
          ]
        ]
      },
      "turnDir": "none",
      "type": "finish"
    }
  ],
  "meta": {
    "generatedBy": "plugin",
    "sourceRide": "",
    "totalDistanceKm": 1.912,
    "trackId": "test",
    "trackName": "D:\\BikesRoadbook\\content\\gpx_library\\stage_river_delta.csv"
  },
  "route": [
    [
      -198.10699462890625,
      -868.89697265625,
      0.0,
      200.0
    ],
    [
      -198.1069793701172,
      -867.89697265625,
      2.0,
      200.0
    ],
    [
      -198.1069793701172,
      -866.89697265625,
      4.0,
      200.0
    ],
    [
      -198.1069793701172,
      -865.8969116210938,
      6.0,
      200.0
    ],
    [
      -198.1069793701172,
      -864.3969116210938,
      8.0,
      200.0
    ],
    [
      -198.1069793701172,
      -862.3969116210938,
      10.0,
      200.0
    ],
    [
      -198.1069793701172,
      -860.3969116210938,
      12.0,
      200.0
    ],
    [
      -198.1069793701172,
      -858.3969116210938,
      14.0,
      200.0
    ],